<?xml version="1.0" encoding="UTF-8"?><categories xmlns:xsi="http://www.w3.org/2001/XMLSchema-instance" xsi:noNamespaceSchemaLocation="products.xsd">
	<category name="Периферия и оргтехника">
		<subcategories>
			<subcategory name="Сканеры">
				
					
					<product>
						<manufacturer>HP</manufacturer>
						<model>SJ200</model>
						<date>01-05-2014</date>
						<color>grey,black</color>
						<price>2950.00</price>
						<count>0</count>
					</product>
				</subcategory>
			</subcategories>
			<subcategory name="Мыши">
				
					
					<product>
						<manufacturer>A4Tech</manufacturer>
						<model>VM007</model>
						<date>30-05-2014</date>
						<color>grey,#2323a2,red,#2ff3ac</color>
						<price>1350.00</price>
						<count>2</count>
					</product>
					<product>
						<manufacturer>A4Tech</manufacturer>
						<model>GN713</model>
						<date>20-11-2013</date>
						<color>blue,#000000</color>
						<price>590.00</price>
						<count>3</count>
					</product>
					<product>
						<manufacturer>A4Tech</manufacturer>
						<model>GF555</model>
						<date>01-05-2014</date>
						<color>#0ca92b,pink,black</color>
						<price>610.00</price>
						<count>0</count>
					</product>
				</subcategory>
			</category>
		</categories>
	